{
  "id": "33333333-3333-4333-8333-333333333333",
  "organizationId": "11111111-1111-4111-8111-111111111111",
  "projectId": "22222222-2222-4222-8222-222222222222",
  "title": "Synthetic checkout error-rate spike",
  "summary": "Synthetic 5xx rate exceeded the deterministic test threshold.",
  "severity": "SEV2",
  "status": "OPEN",
  "rootCause": null,
  "resolutionSummary": null,
  "createdBy": "44444444-4444-4444-8444-444444444444",
  "updatedBy": "44444444-4444-4444-8444-444444444444",
  "createdAt": "2030-01-01T00:00:00Z",
  "updatedAt": "2030-01-01T00:00:00Z",
  "version": 0
}
